name,type
Tekno Returns With New Single/Video 'Mufasa',Videos
LISTEN: Adekunle Gold Rolls out New Album 'Catch Me If You Can',Albums
LISTEN: FAVE Releases Debut EP 'Riddim 5',EP
LISTEN: Goya Menor X Nektunez - Ameno (Amapiano Remix),Music
LISTEN: Olamide and Poco Lee Assist Portable on 'Zazoo Zehh' Remix,Music
Fiokee and Bella Shmurda Get 'Personal' With New Single | LISTEN!,Videos
LISTEN: FAVE Releases Debut EP 'Riddim 5',EP
LISTEN: Goya Menor X Nektunez - Ameno (Amapiano Remix),Music
LISTEN: Olamide and Poco Lee Assist Portable on 'Zazoo Zehh' Remix,Music
Fiokee and Bella Shmurda Get 'Personal' With New Single | LISTEN!,Videos
Last Call Lyrics By Khalid | Official Lyrics,Lyrics
Official 'Elliot's Song' Lyrics By Dominic Fike & Zendaya,Lyrics
Woman Up (And Take It Like A Man) Lyrics By Dolly Parton,Lyrics
Official 'Final Champion' Lyrics By Cruel Santino,Lyrics
Chocolate Lyrics By Magixx | Official Lyrics,Lyrics
I'm Tired Lyrics By Labrinth | Official Lyrics,Lyrics
Official 'Hustle' Lyrics By Dj Neptune Ft Focalistic,Lyrics
Publicity Stunt Lyrics By Gucci Mane | Official Lyrics,Lyrics
Bam Bam Lyrics By Camila Cabello | Official Lyrics,Lyrics
Ay! Lyrics By Machine Gun Kelly Ft Lil Wayne | Official Lyrics,Lyrics
Official 'Love It When You Hate Me' Lyrics By Avril Lavigne,Lyrics
John Dreyz – One more time,Music
Abizzi – Bully,Music
Official 'Neighbourhood Superstar' Lyrics By DaBaby,Lyrics
Attention Lyrics By Omah Lay Ft Justin Bieber | Official Lyrics,Lyrics
Official 'Frozen' Lyrics (Fireboy DML Remix) By Madonna,Lyrics
"SkiiBii, Tory Lanez Link-up For 'Baddest Boy' US Remix - Listen!",Music
"Cruel Santino (Santi) Shares 21-Track Album, 'Subaru Boys: Final Heaven' - Listen!",Albums
DJ Sly Taps CKay For New Single 'It's Lit' - Listen!,Music
"W4 Breaks Hiatus With BNXN-Assisted Single, 'Let Me Know' - Listen!",Music
Usain Boo Lyrics By Kodak Black | Official Lyrics,Lyrics
Avalanche Lyrics By Avril Lavigne | Official Lyrics,Lyrics
Official 'Finesse' Lyrics By Pheelz Feat BNXN (Buju),Lyrics
[LYRICS] Enough For You Lyrics By Olivia Rodrigo,Lyrics
